{
  "type": "tool",
  "name": "echo_secret_tool",
  "description": "Returns its text argument; the runtime substitutes {{$group.VAR}} before the call.",
  "callable": "echo",
  "input": {"text": {"type": "string", "description": "text, may contain {{$demo.TOKEN}}"}},
  "output": {"type": "string"},
  "error": {"type": "string"}
}
