{
  "type": "tool",
  "name": "resolve_secret_tool",
  "description": "Calls ramen_runtime.secrets.resolve on a literal built in code.",
  "callable": "resolve_literal",
  "input": {"var": {"type": "string", "description": "secret variable name, e.g. TOKEN"}},
  "output": {"type": "string"},
  "error": {"type": "string"}
}
